name, mutations, clade, division, country, nuc, sampling_date, originating_lab, submitting_lab, GISAID_EPI_ISL, GenBank_accession
NODE_0000003, ORF8: L84S, B, Hubei, , C8782T; T28144C, 2020.0095189041979, , , , 
Wuhan/HBCDC-HB-06/2020, ORF1a: V1798I; S: D614G, B, Hubei, China, G5657A; A23403G; A25725G, 2020.1024590163934, Wuhan Lung Hospital, Hubei Provincial Center for Disease Control and Prevention, EPI_ISL_412982, 
Wuhan/HBCDC-HB-02/2020, ORF1a: T3959N; S: L752F, B, Hubei, China, C12141A; C23816T, 2020.045081967213, The Central Hospital Of Wuhan, Hubei Provincial Center for Disease Control and Prevention, EPI_ISL_412978, 
Wuhan/HBCDC-HB-04/2020, , B, Hubei, China, T18996C; C24370T; T29029C, 2020.0478142076502, Union Hospital of Tongji Medical College, Huazhong University of Science and Technology, Hubei Provincial Center for Disease Control and Prevention, EPI_ISL_412980, 
Tianmen/HBCDC-HB-07/2020, ORF1a: E972K; ORF1b: P319S, A373V; ORF9b: A11V; S: V615L, B, Hubei, China, A3175G; G3179A; C14422T; C14585T; G23405C; C28315T, 2020.1051912568305, Tianmen Center for Disease Control and Prevention, Hubei Provincial Center for Disease Control and Prevention, EPI_ISL_412983, 
NODE_0000018, ORF1a: P2079L, B, Hubei, , C6501T, 2020.0388062021696, , , , 
Guangdong/2020XN4475-P0042/2020, , B, Guangdong, China, , 2020.0806010928961, Guangdong Provincial Institution of Public Health, Guangdong Provinical Center for Disease Control and Prevention, Guangdong Provincial Institution of Public Health, EPI_ISL_413854, 
India/1-31/2020_travel_history, , , China, , , 2020.0833333333333, , , , 
India/1-31/2020, ORF1a: I476V; ORF1b: T1137I; S: A930V, B, Kerala, India, A1691G; C16877T; C24351T, 2020.0833333333333, Indian Council of Medical Research-National Institute of Virology, National Influenza Center, Indian Council of Medical Research-National Institute of Virology, EPI_ISL_413523, 
NODE_0000045, , B, Hubei, , T8767C; G29593A, 2020.0599360815568, , , , 
Guangdong/2020XN4273-P0036/2020, , B, Guangdong, China, , 2020.0806010928961, Guangdong Provincial Institution of Public Health, Guangdong Provinical Center for Disease Control and Prevention, Guangdong Provincial Institution of Public Health, EPI_ISL_413860, 
SouthKorea/KCDC05/2020, ORF1a: K492T; ORF1b: H1213Y; ORF3a: V259L, B, Seoul, South Korea, A1740C; C17104T; G26167T, 2020.0806010928961, Division of Viral Diseases, Center for Laboratory Control of Infectious Diseases, Korea Centers for Diseases Control and Prevention, Division of Viral Diseases, Center for Laboratory Control of Infectious Diseases, Korea Centers for Diseases Control and Prevention, EPI_ISL_412869, 
NODE_0000066, ORF1b: I1674T, B, Hubei, , T18488C; T23605G, 2020.0610132774978, , , , 
England/01/2020_travel_history, , , Hubei, , , 2020.077868852459, , , , 
England/01/2020, , B, England, United Kingdom, , 2020.077868852459, Respiratory Virus Unit, Microbiology Services Colindale, Public Health England, Respiratory Virus Unit, Microbiology Services Colindale, Public Health England, EPI_ISL_407071, 
England/02/2020_travel_history, , , Hubei, , , 2020.077868852459, , , , 
England/02/2020, ORF10: I13M, B, England, United Kingdom, A29596G, 2020.077868852459, Respiratory Virus Unit, Microbiology Services Colindale, Public Health England, Respiratory Virus Unit, Microbiology Services Colindale, Public Health England, EPI_ISL_407073, 
NODE_0000001, ORF1a: L3606F, B, Hubei, , G11083T, 2020.0208209036296, , , , 
NODE_0000000, ORF1a: F941L; ORF1b: A1219T, B, Anhui, , T3086C; G17122A, 2020.0448737321037, , , , 
Anhui/SZ005/2020, ORF1a: L642F, H1610R; ORF1b: T861I, B, Anhui, China, C2189T; A5094G; C16049T, 2020.0642076502731, Department of microbiology laboratory,Anhui Provincial Center for Disease Control and Prevention, Department of microbiology laboratory,Anhui Provincial Center for Disease Control and Prevention, EPI_ISL_413485, 
SouthKorea/KCDC24/2020, ORF1a: A1997V, B, Chungcheongnam, South Korea, C6255T, 2020.0997267759562, Division of Viral Diseases, Center for Laboratory Control of Infectious Diseases, Korea Centers for Diseases Control and Prevention, Division of Viral Diseases, Center for Laboratory Control of Infectious Diseases, Korea Centers for Diseases Control and Prevention, EPI_ISL_412873, 
NODE_0000007, , B, Hubei, , , 2020.0446871392285, , , , 
Guangdong/GD2020233-P0027/2020, ORF1b: M897V, B, Guangdong, China, T9013A; A16156G, 2020.1024590163934, Guangdong Provincial Institution of Public Health, Guangdong Provinical Center for Disease Control and Prevention, Guangdong Provincial Institution of Public Health, EPI_ISL_413856, 
Yunnan/IVDC-YN-003/2020, , B, Yunnan, China, , 2020.045081967213, National Institute for Viral Disease Control and Prevention, China CDC, National Institute for Viral Disease Control & Prevention, CCDC, EPI_ISL_408480, MT049951
NODE_0000031, ORF1a: L969P, B, Shandong, , T3171C, 2020.0311005097149, , , , 
NODE_0000009, , B, Shandong, , , 2020.0603744029427, , , , 
Shandong/LY007/2020, , B, Shandong, China, , 2020.0669398907103, Shandong Provincial Center for Disease Control and Prevention, Beijing Institute of Microbiology and Epidemiology, EPI_ISL_414940, 
Shandong/LY008/2020, , B, Shandong, China, , 2020.0806010928961, Shandong Provincial Center for Disease Control and Prevention, Beijing Institute of Microbiology and Epidemiology, EPI_ISL_414941, 
NODE_0000033, , B, Shandong, , , 2020.0438311793187, , , , 
Shandong/LY003/2020, N: L121H, B, Shandong, China, A19959G; T28635A, 2020.061475409836, Shandong Provincial Center for Disease Control and Prevention, Beijing Institute of Microbiology and Epidemiology, EPI_ISL_414936, 
NODE_0000011, , B, Shandong, , T29817A; A29819T, 2020.0583561227102, , , , 
Shandong/LY006/2020, , B, Shandong, China, , 2020.0669398907103, Shandong Provincial Center for Disease Control and Prevention, Beijing Institute of Microbiology and Epidemiology, EPI_ISL_414939, 
NODE_0000012, , B, Shandong, , , 2020.0642076502731, , , , 
Shandong/LY004/2020, , B, Shandong, China, , 2020.0696721311476, Shandong Provincial Center for Disease Control and Prevention, Beijing Institute of Microbiology and Epidemiology, EPI_ISL_414937, 
Shandong/LY005/2020, , B, Shandong, China, , 2020.0642076502731, Shandong Provincial Center for Disease Control and Prevention, Beijing Institute of Microbiology and Epidemiology, EPI_ISL_414938, 
NODE_0000166, ORF8: V62L, B, Hubei, , C24034T; T26729C; G28077C, 2020.0365901624752, , , , 
HongKong/VM20001061/2020, S: V367F, B, Hong Kong, Hong Kong, C1663T; G22661T, 2020.058743169399, Hong Kong Department of Health, School of Public Health, The University of Hon g Kong, EPI_ISL_412028, 
USA/CA1/2020_travel_history, , , Hubei, , , 2020.061475409836, , , , 
USA/CA1/2020, ORF14: Q20L; ORF1a: S428N, B, California, USA, G1548A; A28792T, 2020.061475409836, California Department of Public Health, Pathogen Discovery, Respiratory Viruses Branch, Division of Viral Diseases, Centers for Disease Control and Prevention, EPI_ISL_406034, MN994467
Sichuan/IVDC-SC-001/2020, ORF1b: F1908Y, B, Sichuan, China, T19190A, 2020.0396174863388, National Institute for Viral Disease Control and Prevention, China CDC, National Institute for Viral Disease Control & Prevention, CCDC, EPI_ISL_408484, 
USA/IL2/2020_travel_history, , , Hubei, , , 2020.0751366120219, , , , 
USA/IL2/2020, ORF1a: D75E, P971L, B, Illinois, USA, T490A; C3177T, 2020.0751366120219, IL Department of Public Health Chicago Laboratory, Pathogen Discovery, Respiratory Viruses Branch, Division of Viral Diseases, Centers for Disease Control and Prevention, EPI_ISL_410045, MT044257
NODE_0000014, , B, Hubei, , , 2020.060342430177, , , , 
Guangdong/GZ-S6-P0050/2020, ORF1a: L149P, Q986K; S: S50L, B, Guangdong, China, T711C; C3221A; C21711T, 2020.1598360655737, Guangdong Provincial Institution of Public Health, Guangdong Provinical Center for Disease Control and Prevention, Guangdong Provincial Institution of Public Health, EPI_ISL_413873, 
Vietnam/VR03-38142/2020_travel_history, , , Hubei, , , 2020.0642076502731, , , , 
Vietnam/VR03-38142/2020, , B, Thanh Hoa, Vietnam, , 2020.0642076502731, National Influenza Center - National Institute of Hygiene and Epidemiology (NIHE), National Influenza Center - National Institute of Hygiene and Epidemiology (NIHE), EPI_ISL_408668, 
NODE_0000036, N: S197L; ORF14: Q44*; ORF1a: F3071Y; ORF3a: G196V, B, Hubei, , T9477A; C14805T; G25979T; C28657T; C28863T, 2020.145617621702, , , , 
France/GE1583/2020, ORF3a: A54V, B, Grand Est, France, C25553T, 2020.1516393442623, Laboratoire de Virologie Institut de Virologie - INSERM U 1109 Hopitaux Universitaires de Strasbourg, National Reference Center for Viruses of Respiratory Infections, Institut Pasteur, Paris, EPI_ISL_414623, 
Netherlands/NoordBrabant_46/2020, ORF1a: V3420I; ORF1b: C1732F; S: M1237I, B, North Brabant, Netherlands, G10523A; G18662T; G25273C, 2020.1926229508197, Dutch COVID-19 response team, Erasmus Medical Center, EPI_ISL_415503, 
Spain/Valencia2/2020, S: S940F, B, Comunitat Valenciana, Spain, C24381T, 2020.1734972677596, Servicio Microbiologia. Hospital Clinico Universitario. Valencia., Sequencing and Bioinformatics Service. Molecular Epidemiology Laboratory. FISABIO-Public Health, EPI_ISL_414496, MT198651
NODE_0000016, , B, Santiago, , , 2020.156735465259, , , , 
NODE_0000017, , B, Santiago, , , 2020.1701261527674, , , , 
USA/NY2-PV08100/2020, , B, New York, USA, , 2020.1734972677596, MSHS Clinical Microbiology Laboratories, MSHS Pathogen Surveillance Program, EPI_ISL_415151, 
Chile/Santiago-1/2020, , B, Santiago, Chile, , 2020.1707650273224, Clinica Alemana de Santiago, Chile, Instituto de Salud Publica de Chile, EPI_ISL_414579, 
NODE_0000020, , B, Santiago, , , 2020.1651101801551, , , , 
NODE_0000021, , B, Santiago, , , 2020.1694872782123, , , , 
Chile/Santiago_op2d1/2020, , B, Santiago, Chile, , 2020.1789617486338, Laboratory of Molecular Virology, Pontificia Universidad Catolica de Chile, MSHS Pathogen Surveillance Program, EPI_ISL_415658, 
Spain/Valencia3/2020, , B, Comunitat Valenciana, Spain, , 2020.1762295081967, Servicio Microbiologia, Hospital Clinico Universitario, Valencia, Sequencing and Bioinformatics Service and Molecular Epidemiology Research Group. FISABIO-Public Health., EPI_ISL_414598, MT198652
NODE_0000022, , B, Santiago, , , 2020.1700971717062, , , , 
Chile/Santiago_op3d1/2020, , B, Santiago, Chile, , 2020.181693989071, Laboratory of Molecular Virology, Pontificia Universidad Catolica de Chile, MSHS Pathogen Surveillance Program, EPI_ISL_415660, 
Chile/Santiago_op4d1/2020, , B, Santiago, Chile, , 2020.1844262295083, Laboratory of Molecular Virology, Pontificia Universidad Catolica de Chile, MSHS Pathogen Surveillance Program, EPI_ISL_415661, 
NODE_0000019, N: S202N; ORF14: V49I, B4, Queensland, , G28878A; G29742A, 2020.0384806643228, , , , 
Australia/QLD02/2020, S: P1143L, B4, Queensland, Australia, C24990T; C25587T, 2020.0806010928961, Pathology Queensland, Public Health Virology Laboratory, EPI_ISL_407896, 
NODE_0000023, , B4, Queensland, , , 2020.0578257046946, , , , 
Australia/QLD03/2020, , B4, Queensland, Australia, T18603C, 2020.0969945355191, Pathology Queensland, Public Health Virology Laboratory, EPI_ISL_410717, 
NODE_0000024, , B4, Queensland, , , 2020.05911286694, , , , 
NODE_0000025, , B4, Queensland, , , 2020.0750194367731, , , , 
Australia/QLD01/2020_travel_history, , , Hubei, , , 2020.0751366120219, , , , 
Australia/QLD01/2020, , B4, Queensland, Australia, , 2020.0751366120219, Pathology Queensland, Public Health Virology Laboratory, EPI_ISL_407894, 
NODE_0000027, , B4, Queensland, , , 2020.0764065921837, , , , 
Australia/QLD04/2020, , B4, Queensland, Australia, , 2020.0969945355191, Pathology Queensland, Public Health Virology Laboratory, EPI_ISL_410718, 
USA/CA7/2020_travel_history, , , Hubei, , , 2020.0997267759562, , , , 
USA/CA7/2020, , B4, California, USA, , 2020.0997267759562, California Department of Public Health, Pathogen Discovery, Respiratory Viruses Branch, Division of Viral Diseases, Centers for Disease Control and Prevention, EPI_ISL_411954, MT106052
NODE_0000028, , B4, Hubei, , , 2020.0714055068283, , , , 
NODE_0000029, , B4, Hubei, , , 2020.077229977904, , , , 
Guangdong/2020XN4243-P0035/2020, , B4, Guangdong, China, , 2020.0806010928961, Guangdong Provincial Institution of Public Health, Guangdong Provinical Center for Disease Control and Prevention, Guangdong Provincial Institution of Public Health, EPI_ISL_413853, 
Singapore/4/2020_travel_history, , , Hubei, , , 2020.0915300546449, , , , 
Singapore/4/2020, , B4, Singapore, Singapore, , 2020.0915300546449, National Centre for Infectious Diseases, Programme in Emerging Infectious Diseases, Duke-NUS Medical School, EPI_ISL_410535, 
NODE_0000026, ORF1b: V972I, B4, Utrecht, , G16381A, 2020.1567169101083, , , , 
Netherlands/Utrecht_16/2020, ORF1a: A1997V, B4, Utrecht, Netherlands, C6255T, 2020.1844262295083, Dutch COVID-19 response team, Erasmus Medical Center, EPI_ISL_414555, 
NODE_0000030, , B4, Utrecht, , , 2020.169664020429, , , , 
Netherlands/Utrecht_17/2020, , B4, Utrecht, Netherlands, , 2020.1898907103825, Dutch COVID-19 response team, Erasmus Medical Center, EPI_ISL_415526, 
Netherlands/Gelderland/1/2020, , B4, Gelderland, Netherlands, , 2020.1898907103825, Dutch COVID-19 response team, Erasmus Medical Center, EPI_ISL_415461, 
NODE_0000072, ORF1a: L1599F, B, Beijing, , T4402C; G5062T, 2020.0386340792431, , , , 
Beijing/233/2020, N: D343V, B, Beijing, China, A29301T, 2020.0751366120219, , Infectious Disease Control Center, EPI_ISL_413520, 
SouthKorea/KCDC07/2020, ORF1a: S505F; ORF1b: A517V, B, Seoul, South Korea, C1779T; C15017T, 2020.0833333333333, Division of Viral Diseases, Center for Laboratory Control of Infectious Diseases, Korea Centers for Diseases Control and Prevention, Division of Viral Diseases, Center for Laboratory Control of Infectious Diseases, Korea Centers for Diseases Control and Prevention, EPI_ISL_412871, 
NODE_0000041, , B, Beijing, , , 2020.0582981780121, , , , 
SouthKorea/KCDC03/2020, , B, Gyeonggi, South Korea, , 2020.0669398907103, Korea Centers for Disease Control & Prevention (KCDC) Center for Laboratory Control of Infectious Diseases Division of Viral Diseases, Korea Centers for Disease Control & Prevention (KCDC) Center for Laboratory Control of Infectious Diseases Division of Viral Diseases, EPI_ISL_407193, 
NODE_0000032, , B, Beijing, , , 2020.0596721311476, , , , 
Beijing/231/2020, , B, Beijing, China, , 2020.0751366120219, , Infectious Disease Control Center, EPI_ISL_413519, 
NODE_0000034, , B, Beijing, , , 2020.0663010161554, , , , 
Beijing/105/2020, , B, Beijing, China, , 2020.0696721311476, , Infectious Disease Control Center, EPI_ISL_413518, 
NODE_0000035, , B, Beijing, , , 2020.0696721311476, , , , 
Beijing/235/2020, , B, Beijing, China, , 2020.0751366120219, , Infectious Disease Control Center, EPI_ISL_413521, 
NODE_0000037, , B, Seoul, , , 2020.077229977904, , , , 
SouthKorea/KCDC06/2020, , B, Seoul, South Korea, , 2020.0806010928961, Division of Viral Diseases, Center for Laboratory Control of Infectious Diseases, Korea Centers for Diseases Control and Prevention, Division of Viral Diseases, Center for Laboratory Control of Infectious Diseases, Korea Centers for Diseases Control and Prevention, EPI_ISL_412870, 
NODE_0000038, , B, South Korea, , , 2020.1514472084548, , , , 
NODE_0000039, , B, South Korea, , , 2020.1571038251366, , , , 
SouthKorea/KUMC06/2020, , B, South Korea, South Korea, , 2020.1571038251366, Department of Microbiology, Institute for Viral Diseases, College of Medicine, Korea University, Department of Microbiology, Institute for Viral Diseases, College of Medicine, Korea University, EPI_ISL_413516, 
SouthKorea/KUMC04/2020, , B, South Korea, South Korea, , 2020.1571038251366, Department of Microbiology, Institute for Viral Diseases, College of Medicine, Korea University, Department of Microbiology, Institute for Viral Diseases, College of Medicine, Korea University, EPI_ISL_413514, 
NODE_0000040, , B, South Korea, , , 2020.1571038251366, , , , 
SouthKorea/KUMC03/2020, , B, South Korea, South Korea, , 2020.1571038251366, Division of Infectious Diseases, Department of Internal Medicine, Korea University College of Medicine, Department of Microbiology, Institute for Viral Diseases, College of Medicine, Korea University, EPI_ISL_413513, 
SouthKorea/KUMC05/2020, , B, South Korea, South Korea, , 2020.1571038251366, Division of Infectious Diseases, Department of Internal Medicine, Korea University College of Medicine, Department of Microbiology, Institute for Viral Diseases, College of Medicine, Korea University, EPI_ISL_413515, 
NODE_0000046, , B2, Hubei, , C29095T, 2020.0187228880227, , , , 
Shenzhen/HKU-SZ-005/2020, ORF1a: S3099L, B2, Guangdong, China, C9561T; T15607C, 2020.02868852459, The University of Hong Kong - Shenzhen Hospital, Li Ka Shing Faculty of Medicine, The University of Hong Kong, EPI_ISL_405839, MN975262
USA/TX1/2020_travel_history, , , Hubei, , , 2020.113387978142, , , , 
USA/TX1/2020, ORF1b: D1903A; ORF8: T11I, B2, Texas, USA, T18603C; T18975A; A19175C; C27925T, 2020.113387978142, Texas Department of State Health Services, Pathogen Discovery, Respiratory Viruses Branch, Division of Viral Diseases, Centers for Disease Control and Prevention, EPI_ISL_411956, MT106054
NODE_0000056, E: S68C; ORF8: D119E, B2, Hubei, , C26447G; T28250G, 2020.077229977904, , , , 
Guangdong/2020XN4291-P0038/2020, , B2, Guangdong, China, , 2020.0806010928961, Guangdong Provincial Institution of Public Health, Guangdong Provinical Center for Disease Control and Prevention, Guangdong Provincial Institution of Public Health, EPI_ISL_413889, 
Guangzhou/GZMU0042/2020, , B2, Guangdong, China, , 2020.1516393442623, State Key Laboratory of Respiratory Disease, National Clinical Research Center for Respiratory Disease, Guangzhou Institute of Respiratory Health, the First Affiliated Hospital of Guangzhou Medical University, The First Affiliated Hospital of Guangzhou Medical University & BGI-Shenzhen, EPI_ISL_414688, 
NODE_0000047, , B2, Tokyo, , C2662T, 2020.0597355283876, , , , 
Guangdong/SZ-N128-P0057/2020, ORF1b: P160S, A440V, R712H, B2, Guangdong, China, C10789T; C13945T; C14786T; G15602A, 2020.1598360655737, Guangdong Provincial Institution of Public Health, Guangdong Provinical Center for Disease Control and Prevention, Guangdong Provincial Institution of Public Health, EPI_ISL_413897, 
Japan/TY-WK-012/2020, ORF1a: A1176V, B2, Tokyo, Japan, C3792T, 2020.077868852459, Dept. of Virology III, National Institute of Infectious Diseases, Pathogen Genomics Center, National Institute of Infectious Diseases, EPI_ISL_408665, LC522973
Japan/TY-WK-501/2020, , B2, Tokyo, Japan, , 2020.0833333333333, Dept. of Virology III, National Institute of Infectious Diseases, Pathogen Genomics Center, National Institute of Infectious Diseases, EPI_ISL_408666, LC522974
Japan/TY-WK-521/2020, , B2, Tokyo, Japan, G29705T, 2020.0833333333333, Dept. of Virology III, National Institute of Infectious Diseases, Pathogen Genomics Center, National Institute of Infectious Diseases, EPI_ISL_408667, LC522975
NODE_0000044, , B2, Hubei, , , 2020.0195047276536, , , , 
NODE_0000048, , B2, Hubei, , , 2020.025956284153, , , , 
Shenzhen/HKU-SZ-002/2020, , B2, Guangdong, China, , 2020.025956284153, The University of Hong Kong - Shenzhen Hospital, Li Ka Shing Faculty of Medicine, The University of Hong Kong, EPI_ISL_406030, MN938384
NODE_0000049, , B2, Hubei, , , 2020.0368852459017, , , , 
Germany/BavPat3/2020, S: E780Q, B2, Bavaria, Germany, G23900C, 2020.1680327868853, Bundeswehr Institute of Microbiology, Bundeswehr Institute of Microbiology, EPI_ISL_414521, 
Guangdong/20SF012/2020, , B2, Guangdong, China, , 2020.0368852459017, Guangdong Provincial Center for Diseases Control and Prevention; Guangdong Provincial Public Health, Department of Microbiology, Guangdong Provincial Center for Diseases Control and Prevention, EPI_ISL_403932, 
NODE_0000050, , B2, Hubei, , , 2020.0203848137812, , , , 
NODE_0000051, ORF1a: L3606F, B2, Hubei, , G11083T, 2020.058743169399, , , , 
USA/AZ1/2020_travel_history, , , Hubei, , , 2020.058743169399, , , , 
USA/AZ1/2020, , B2, Arizona, USA, , 2020.058743169399, Arizona Department of Health Services, Pathogen Discovery, Respiratory Viruses Branch, Division of Viral Diseases, Centers for Disease Control and Prevention, EPI_ISL_406223, MN997409
Guangdong/2020XN4276-P0037/2020, , B2, Guangdong, China, T240C, 2020.0833333333333, Guangdong Provincial Institution of Public Health, Guangdong Provinical Center for Disease Control and Prevention, Guangdong Provincial Institution of Public Health, EPI_ISL_413859, 
NODE_0000052, , B2, Hubei, , , 2020.030189791869, , , , 
Shenzhen/SZTH-002/2020, , B2, Guangdong, China, , 2020.0341530054645, Shenzhen Key Laboratory of Pathogen and Immunity, National Clinical Research Center for Infectious Disease, Shenzhen Third People's Hospital, Shenzhen Key Laboratory of Pathogen and Immunity, National Clinical Research Center for Infectious Disease, Shenzhen Third People's Hospital, EPI_ISL_406593, 
NODE_0000053, , B2, Hubei, , , 2020.0396174863388, , , , 
Guangdong/20SF025/2020, , B2, Guangdong, China, , 2020.0396174863388, Guangdong Provincial Center for Diseases Control and Prevention; Guangdong Provincial Public Health, Department of Microbiology, Guangdong Provincial Center for Diseases Control and Prevention, EPI_ISL_403935, 
Guangdong/20SF013/2020, , B2, Guangdong, China, , 2020.0396174863388, Guangdong Provincial Center for Diseases Control and Prevention; Guangdong Provincial Public Health, Department of Microbiology, Guangdong Provincial Center for Diseases Control and Prevention, EPI_ISL_403933, 
NODE_0000054, , B, Hubei, , , 2020.0104103325807, , , , 
Wuhan/WH04/2020, , B, Hubei, China, , 2020.0122950819673, General Hospital of Central Theater Command of People's Liberation Army of China, BGI & Institute of Microbiology, Chinese Academy of Sciences & Shandong First Medical University & Shandong Academy of Medical Sciences & General Hospital of Central Theater Command of People's Liberation Army of China, EPI_ISL_406801, LR757995
NODE_0000055, , B, Hubei, , , 2020.0105650639814, , , , 
NODE_0000057, , B, Singapore, , , 2020.0390408240746, , , , 
Singapore/12/2020, ORF3a: A59D; S: F817L, B, Singapore, Singapore, T24011C; C25568A; C29741T, 2020.129781420765, National Centre for Infectious Diseases, Programme in Emerging Infectious Diseases, Duke-NUS Medical School, EPI_ISL_414378, 
NODE_0000067, N: D103Y; ORF1b: V1814F, B, Talca, , C17470T; G18907T; C26088T; G28580T, 2020.1680327868853, , , , 
Chile/Talca-1/2020, , B, Talca, Chile, , 2020.1680327868853, Hospital de Talca, Chile, Instituto de Salud Publica de Chile, EPI_ISL_414577, 
Chile/Talca-2/2020, , B, Talca, Chile, , 2020.1734972677596, Hospital de Talca, Chile, Instituto de Salud Publica de Chile, EPI_ISL_414578, 
NODE_0000059, , B, Hubei, , , 2020.0356916473775, , , , 
NODE_0000060, , B, Hubei, , , 2020.0447422077873, , , , 
Wuhan/HBCDC-HB-03/2020, , B, Hubei, China, , 2020.0478142076502, Union Hospital of Tongji Medical College, Huazhong University of Science and Technology, Hubei Provincial Center for Disease Control and Prevention, EPI_ISL_412979, 
NODE_0000071, S: S50L, B, Hubei, , C21711T, 2020.0775320722846, , , , 
Guangdong/ZS-S6-P0060/2020, , B, Guangdong, China, C16407A, 2020.1598360655737, Guangdong Provincial Institution of Public Health, Guangdong Provinical Center for Disease Control and Prevention, Guangdong Provincial Institution of Public Health, EPI_ISL_413900, 
Guangdong/FS-S30-P0052/2020, , B, Guangdong, China, C18060T; C24382T, 2020.1598360655737, Guangdong Provincial Institution of Public Health, Guangdong Provinical Center for Disease Control and Prevention, Guangdong Provincial Institution of Public Health, EPI_ISL_413892, 
NODE_0000062, , B, Hubei, , , 2020.0431613390685, , , , 
NODE_0000063, , B, Hubei, , , 2020.0560109289618, , , , 
USA/IL1/2020_travel_history, , , Hubei, , , 2020.0560109289618, , , , 
USA/IL1/2020, , B, Illinois, USA, , 2020.0560109289618, IL Department of Public Health Chicago Laboratory, Pathogen Discovery, Respiratory Viruses Branch, Division of Viral Diseases, Centers for Disease Control and Prevention, EPI_ISL_404253, MN988713
Australia/NSW01/2020_travel_history, , , Hubei, , , 2020.0642076502731, , , , 
Australia/NSW01/2020, , B, New South Wales, Australia, , 2020.0642076502731, Centre for Infectious Diseases and Microbiology Laboratory Services, NSW Health Pathology - Institute of Clinical Pathology and Medical Research; Westmead Hospital; University of Sydney, EPI_ISL_407893, 
NODE_0000064, , B, Hubei, , , 2020.052910118295, , , , 
NODE_0000065, , B, Hubei, , , 2020.0620423416863, , , , 
Hangzhou/ZJU-02/2020, , B, Zhejiang, China, , 2020.0696721311476, State Key Laboratory for Diagnosis and Treatment of Infectious Diseases, National Clinical Research Center for Infectious Diseases, First Affiliated Hospital, Zhejiang University School of Medicine, Hangzhou, China. 310003, State Key Laboratory for Diagnosis and Treatment of Infectious Diseases, National Clinical Research Center for Infectious Diseases, First Affiliated Hospital, Zhejiang University School of Medicine, Hangzhou, China. 310003, EPI_ISL_416042, 
Taiwan/3/2020, , B, Taiwan, Taiwan, , 2020.0642076502731, Taiwan Centers for Disease Control, Taiwan Centers for Disease Control, EPI_ISL_411926, 
NODE_0000068, , B, Singapore, , , 2020.0587363302875, , , , 
Singapore/13/2020, N: P199S; ORF1b: V1419A, B, Singapore, Singapore, T17723C; C28868T, 2020.1325136612022, National Centre for Infectious Diseases, Programme in Emerging Infectious Diseases, Duke-NUS Medical School, EPI_ISL_414379, 
NODE_0000069, , B, Singapore, , , 2020.067404723663, , , , 
NODE_0000070, , B, Hubei, , , 2020.0772180918186, , , , 
