NODE_0000533, ORF3a: Q57H, A2a, Hauts de France, , G25563T, 2020.140545228735, , , , 
NODE_0000452, , A2a, Hauts de France, , , 2020.1515599118866, , , , 
France/HF1805/2020, S: I1132V, A2a, Hauts de France, France, A24956G, 2020.1680327868853, Centre Hospitalier Compiegne Laboratoire de Biologie, National Reference Center for Viruses of Respiratory Infections, Institut Pasteur, Paris, EPI_ISL_414628, 
Taiwan/NTU03/2020, , A2a, Taiwan, Taiwan, C18877T, 2020.1680327868853, Department of Laboratory Medicine, National Taiwan University Hospital, Microbial Genomics Core Lab, National Taiwan University Centers of Genomic and Precision Medicine, EPI_ISL_413592, 
NODE_0000535, , A2a, Hauts de France, , C2416T, 2020.15702554053, , , , 
France/GE1977/2020, S: S939F, A2a, Grand Est, France, G210T; C24378T; G29543T, 2020.1734972677596, Hopital Robert Debre Laboratoire de Virologie, National Reference Center for Viruses of Respiratory Infections, Institut Pasteur, Paris, EPI_ISL_414632, 
France/HF1993/2020, , A2a, Hauts de France, France, C19884T, 2020.1734972677596, Centre Hospitalier Compiegne Laboratoire de Biologie, National Reference Center for Viruses of Respiratory Infections, Institut Pasteur, Paris, EPI_ISL_414637, 
France/HF2174/2020, ORF1b: P2256L, A2a, Hauts de France, France, A12745G; C20234T, 2020.1871584699454, Centre Hospitalier Compiegne Laboratoire de Biologie, National Reference Center for Viruses of Respiratory Infections, Institut Pasteur, Paris, EPI_ISL_415654, 
France/HF1995/2020, ORF1a: S4153P, A2a, Hauts de France, France, T12722C, 2020.1734972677596, Centre Hospitalier Compiegne Laboratoire de Biologie, National Reference Center for Viruses of Respiratory Infections, Institut Pasteur, Paris, EPI_ISL_414638, 
NODE_0000454, , A2a, Hauts de France, , , 2020.1620635249362, , , , 
France/HF1684/2020, , A2a, Hauts de France, France, , 2020.1625683060108, , National Reference Center for Viruses of Respiratory Infections, Institut Pasteur, Paris, EPI_ISL_414626, 
NODE_0000455, , A2a, Hauts de France, , , 2020.1701261527674, , , , 
Congo/KN-13/2020, , A2a, Kinshasa, Congo, , 2020.1871584699454, Viral Respiratory Lab, National Institute for Biomedical Research (INRB), Pathogen Sequencing Lab, National Institute for Biomedical Research (INRB), EPI_ISL_414647, 
France/IDF1980/2020, , A2a, Ile de France, France, , 2020.1734972677596, Centre Hospitalier Rene Dubois Laboratoire de Microbiologie - Bat A, National Reference Center for Viruses of Respiratory Infections, Institut Pasteur, Paris, EPI_ISL_414633, 
NODE_0000545, ORF1a: T265I, A2a, Hauts de France, , C1059T, 2020.134386202893, , , , 
NODE_0000552, ORF1a: N2187T, L4365F, A2a, Netherlands, , A6825C; C13358T, 2020.170738000693, , , , 
Netherlands/NA/20/2020, ORF1a: A1997V; ORF3a: Q57H, A2a, Netherlands, Netherlands, C6255T; G25563T, 2020.1953551912568, Dutch COVID-19 response team, Erasmus Medical Center, EPI_ISL_415477, 
Netherlands/NoordHolland_3/2020, , A2a, North Holland, Netherlands, , 2020.1953551912568, Dutch COVID-19 response team, Erasmus Medical Center, EPI_ISL_415525, 
NODE_0000458, , A2a, Netherlands, , , 2020.1565679152538, , , , 
NODE_0000459, , A2a, South Holland, , , 2020.169025145874, , , , 
Netherlands/NoordBrabant_59/2020, , A2a, North Brabant, Netherlands, , 2020.1926229508197, Dutch COVID-19 response team, Erasmus Medical Center, EPI_ISL_415515, 
Netherlands/ZuidHolland_30/2020, , A2a, South Holland, Netherlands, , 2020.1926229508197, Dutch COVID-19 response team, Erasmus Medical Center, EPI_ISL_415534, 
NODE_0000460, , A2a, Netherlands, , , 2020.167878630692, , , , 
NODE_0000461, , A2a, Netherlands, , , 2020.169664020429, , , , 
Netherlands/NA/13/2020, , A2a, Netherlands, Netherlands, , 2020.1898907103825, Dutch COVID-19 response team, Erasmus Medical Center, EPI_ISL_415469, 
Netherlands/NA/1/2020, , A2a, Netherlands, Netherlands, , 2020.1898907103825, Dutch COVID-19 response team, Erasmus Medical Center, EPI_ISL_415465, 
NODE_0000462, , A2a, Netherlands, , , 2020.1703028949842, , , , 
Netherlands/Flevoland/1/2020, , A2a, Flevoland, Netherlands, , 2020.1871584699454, Dutch COVID-19 response team, Erasmus Medical Center, EPI_ISL_415460, 
Netherlands/NA/10/2020, , A2a, Netherlands, Netherlands, , 2020.1871584699454, Dutch COVID-19 response team, Erasmus Medical Center, EPI_ISL_415466, 
NODE_0000553, ORF3a: Q57H, A2a, Hauts de France, , G25563T, 2020.141847450218, , , , 
France/HF1986/2020, ORF1a: M2796V; S: P1162A, A2a, Hauts de France, France, C5348T; A8651G; C25046G, 2020.1734972677596, Centre Hospitalier Compiegne Laboratoire de Biologie, National Reference Center for Viruses of Respiratory Infections, Institut Pasteur, Paris, EPI_ISL_414634, 
France/PL1643/2020, , A2a, Pays de la Loire, France, C12049T; T13521C, 2020.1543715846994, Centre Hospitalier Regional Universitaire de Nantes Laboratoire de Virologie, National Reference Center for Viruses of Respiratory Infections, Institut Pasteur, Paris, EPI_ISL_414625, 
France/HF1871/2020, ORF1a: L580F, A2a, Hauts de France, France, C2003T; C10582T; C27059T, 2020.1707650273224, Centre Hospitalier Compiegne Laboratoire de Biologie, National Reference Center for Viruses of Respiratory Infections, Institut Pasteur, Paris, EPI_ISL_414630, 
Denmark/SSI-104/2020, ORF1a: T346I; ORF1b: T1730I, A2a, Hauts de France, Italy, C1302T; C18656T, 2020.1707650273224, Department of Virus and Microbiological Special diagnostics, Statens Serum Institut, Copenhagen, Denmark., ViFU, EPI_ISL_415648, 
NODE_0000559, , A2a, Hauts de France, , A20766G, 2020.1566416927983, , , , 
France/HF1988/2020, , A2a, Hauts de France, France, , 2020.1734972677596, Centre Hospitalier Compiegne Laboratoire de Biologie, National Reference Center for Viruses of Respiratory Infections, Institut Pasteur, Paris, EPI_ISL_414635, 
France/HF1989/2020, , A2a, Hauts de France, France, A15213G; G26199T, 2020.1734972677596, Centre Hospitalier Compiegne Laboratoire de Biologie, National Reference Center for Viruses of Respiratory Infections, Institut Pasteur, Paris, EPI_ISL_414636, 
NODE_0000567, , A2a, Hauts de France, , T1666C, 2020.1423718624415, , , , 
Belgium/BA-02291/2020, S: K458R, H519P, T941A, S943P, A2a, Leuven, Belgium, A22935G; A23118C; C24382T; A24383G; A24389C; G24390C, 2020.1625683060108, KU Leuven, Clinical and Epidemiological Virology, KU Leuven, Clinical and Epidemiological Virology, EPI_ISL_415159, 
NODE_0000466, , A2a, Hauts de France, , , 2020.159071164915, , , , 
Netherlands/Haarlem_1363688/2020, , A2a, North Holland, Netherlands, , 2020.1653005464482, MHC Kennemerland, Erasmus Medical Center, EPI_ISL_413572, 
France/HF2039/2020, S: A653V, A2a, Hauts de France, France, C23520T, 2020.1762295081967, , National Reference Center for Viruses of Respiratory Infections, Institut Pasteur, Paris, EPI_ISL_415649, 
NODE_0000467, , A2a, Hauts de France, , , 2020.1514023974848, , , , 
NODE_0000468, , A2a, Netherlands, , , 2020.1524102183107, , , , 
Netherlands/NA/24/2020, ORF1a: A1997V, A2a, Netherlands, Netherlands, C6255T, 2020.1844262295083, Dutch COVID-19 response team, Erasmus Medical Center, EPI_ISL_415481, 
NODE_0000569, , A2a, Washington, , G29553A, 2020.1678321566549, , , , 
USA/WA-UW29/2020, , A2a, Washington, USA, , 2020.1844262295083, UW Virology Lab, UW Virology Lab, EPI_ISL_414616, 
NODE_0000470, , A2a, Washington, , , 2020.169664020429, , , , 
USA/WA-UW60/2020, , A2a, Washington, USA, , 2020.1871584699454, UW Virology Lab, UW Virology Lab, EPI_ISL_415625, 
USA/WA-UW69/2020, , A2a, Washington, USA, , 2020.1898907103825, UW Virology Lab, UW Virology Lab, EPI_ISL_415597, 
NODE_0000474, , A2a, Hauts de France, , , 2020.15263380578, , , , 
NODE_0000476, , A2a, Netherlands, , , 2020.1595461806246, , , , 
Netherlands/NA_30/2020, ORF3a: F8L, A2a, Netherlands, Netherlands, T25414C, 2020.198087431694, Dutch COVID-19 response team, Erasmus Medical Center, EPI_ISL_415487, 
NODE_0000565, , A2a, Utah, , C379A, 2020.1704676025277, , , , 
USA/UPHL-05/2020, , A2a, Utah, USA, , 2020.198087431694, Utah Public Health Laboratory, Utah Public Health Laboratory, EPI_ISL_415543, 
USA/UPHL-06/2020, , A2a, Utah, USA, , 2020.198087431694, Utah Public Health Laboratory, Utah Public Health Laboratory, EPI_ISL_415544, 
NODE_0000478, , A2a, Hauts de France, , , 2020.1597999442506, , , , 
France/IDF2075/2020, N: R195K; ORF14: E42K, A2a, Ile de France, France, G28857A, 2020.1680327868853, Hopital Instruction des Armees - BEGIN, National Reference Center for Viruses of Respiratory Infections, Institut Pasteur, Paris, EPI_ISL_415650, 
NODE_0000479, , A2a, Hauts de France, , , 2020.1680327868853, , , , 
Finland/FIN-455/2020, , A2a, Finland, Finland, , 2020.1844262295083, Department of Virology and Immunology, University of Helsinki and Helsinki University Hospital, Huslab Finland, Department of Virology, Faculty of Medicine, University of Helsinki, Helsinki, Finland, EPI_ISL_414642, 
France/HF1795/2020, , A2a, Hauts de France, France, , 2020.1680327868853, Centre Hospitalier Compiegne Laboratoire de Biologie, National Reference Center for Viruses of Respiratory Infections, Institut Pasteur, Paris, EPI_ISL_414627, 
NODE_0000181, , A2a, Netherlands, , , 2020.055875562749, , , , 
NODE_0000523, ORF1a: S2242F, A2a, Wales, , C6990T, 2020.1419438251758, , , , 
Wales/PHW13/2020, N: A397S; ORF1a: L1627I, W4096C, Q4099*, A2a, Wales, United Kingdom, C5144A; G12553T; C12560T; G29462T, 2020.1844262295083, Wales Specialist Virology Centre, Public Health Wales Microbiology Cardiff, EPI_ISL_415537, 
NODE_0000444, , A2a, Wales, , , 2020.1592964931094, , , , 
Wales/PHW10/2020, ORF1b: L2672P, A2a, Wales, United Kingdom, T21482C, 2020.1898907103825, Wales Specialist Virology Centre, Public Health Wales Microbiology Cardiff, EPI_ISL_415453, 
NODE_0000445, , A2a, Wales, , , 2020.169664020429, , , , 
Wales/PHW12/2020, , A2a, Wales, United Kingdom, , 2020.1898907103825, Wales Specialist Virology Centre, Public Health Wales Microbiology Cardiff, EPI_ISL_415536, 
Wales/PHW21/2020, , A2a, Wales, United Kingdom, , 2020.1926229508197, Wales Specialist Virology Centre, Public Health Wales Microbiology Cardiff, EPI_ISL_416026, 
NODE_0000187, , A2a, Netherlands, , , 2020.0639156703828, , , , 
NODE_0000529, ORF1a: A3615V, A2a, Netherlands, , C1594T; C11109T, 2020.1596211481824, , , , 
Netherlands/NA/28/2020, ORF1a: R398C, A2a, Netherlands, Netherlands, C1457T, 2020.1953551912568, Dutch COVID-19 response team, Erasmus Medical Center, EPI_ISL_415485, 
NODE_0000437, , A2a, Netherlands, , , 2020.1703028949842, , , , 
Netherlands/NA/18/2020, , A2a, Netherlands, Netherlands, , 2020.1871584699454, Dutch COVID-19 response team, Erasmus Medical Center, EPI_ISL_415474, 
Netherlands/NA/17/2020, , A2a, Netherlands, Netherlands, , 2020.1871584699454, Dutch COVID-19 response team, Erasmus Medical Center, EPI_ISL_415473, 
NODE_0000196, , A2a, England, , , 2020.0773302348407, , , , 
England/20100022706/2020, ORF1a: S2237I, V2238I, A2a, England, United Kingdom, G6975T; G6977A, 2020.1625683060108, Respiratory Virus Unit, Microbiology Services Colindale, Public Health England, Respiratory Virus Unit, Microbiology Services Colindale, Public Health England, EPI_ISL_415136, 
NODE_0000202, , A2a, England, , , 2020.0775517758896, , , , 
NODE_0000210, , A2a, Helsinki, , , 2020.1346530520436, , , , 
Finland/FIN03032020A/2020, ORF10: P10S; S: A435S, A2a, Helsinki, Finland, G22865T; C29585T, 2020.1707650273224, Department of Virology and Immunology, University of Helsinki and Helsinki University Hospital, Huslab Finland, Department of Virology, Faculty of Medicine, University of Helsinki, Helsinki, Finland, EPI_ISL_413602, 
NODE_0000486, , A2a, Utrecht, , A187G, 2020.1420683318206, , , , 
France/N1620/2020, ORF1a: T3488I, A2a, Normandie, France, C10728T, 2020.1543715846994, Centre Hositalier Universitaire de Rouen Laboratoire de Virologie, National Reference Center for Viruses of Respiratory Infections, Institut Pasteur, Paris, EPI_ISL_414624, 
Italy/UniSR1/2020, ORF1a: I2231L, A2a, Lombardy, Italy, A6956C, 2020.1707650273224, Laboratorio di Microbiologia e Virologia, Universita Vita-Salute San Raffaele, Milano, Laboratorio di Microbiologia e Virologia, Universita Vita-Salute San Raffaele, Milano, EPI_ISL_413489, 
NetherlandsL/Houten_1363498/2020, , A2a, Utrecht, Netherlands, A3778G, 2020.1625683060108, RIVM, Erasmus Medical Center, EPI_ISL_413575, 
NODE_0000447, , A2a, Utrecht, , , 2020.1489071038252, , , , 
Netherlands/Utrecht_3/2020, , A2a, Utrecht, Netherlands, , 2020.1707650273224, Dutch COVID-19 response team, Erasmus Medical Center, EPI_ISL_414437, 
Switzerland/TI9486/2020, , A2a, Ticino, Switzerland, , 2020.1489071038252, Laboratoire de Virologie, HUG, Swiss National Reference Centre for Influenza, EPI_ISL_413996, 
NODE_0000229, , A2a, England, , , 2020.0958615165503, , , , 
NODE_0000606, M: D3G, A2a, England, , A26530G, 2020.1422621559066, , , , 
Switzerland/AG0361/2020, ORF1b: E2311K, A2a, Aargau, Switzerland, G20398A, 2020.1571038251366, Laboratoire de Virologie, HUG, Swiss National Reference Centre for Influenza, EPI_ISL_413999, 
NODE_0000607, N: A156S, A2a, England, , G28739T, 2020.1543715846994, , , , 
England/200991076/2020, , A2a, England, United Kingdom, , 2020.1653005464482, Respiratory Virus Unit, Microbiology Services Colindale, Public Health England, Respiratory Virus Unit, Microbiology Services Colindale, Public Health England, EPI_ISL_414524, 
England/200981386/2020, , A2a, England, United Kingdom, , 2020.1543715846994, Respiratory Virus Unit, Microbiology Services Colindale, Public Health England, Respiratory Virus Unit, Microbiology Services Colindale, Public Health England, EPI_ISL_414010, 
NODE_0000450, , A2a, England, , , 2020.1701261527674, , , , 
Scotland/CVR05/2020, , A2a, Scotland, United Kingdom, , 2020.1734972677596, West of Scotland Specialist Virology Centre, NHSGGC, MRC-University of Glasgow Centre for Virus Research, EPI_ISL_414027, 
Finland/FIN-266/2020_travel_history, , , Iran, , , 2020.1734972677596, , , , 
Finland/FIN-266/2020, , A2a, Finland, Finland, , 2020.1734972677596, Department of Virology and Immunology, University of Helsinki and Helsinki University Hospital, Huslab Finland, Department of Virology, Faculty of Medicine, University of Helsinki, Helsinki, Finland, EPI_ISL_414646, 
NODE_0000240, , A2a, England, , , 2020.1048051541413, , , , 
NODE_0000244, , A2a, England, , , 2020.1328693541927, , , , 
NODE_0000596, S: D839Y, A2a, England, , G24077T, 2020.1566239013123, , , , 
England/20102000506/2020, , A2a, England, United Kingdom, , 2020.1653005464482, Respiratory Virus Unit, Microbiology Services Colindale, Public Health England, Respiratory Virus Unit, Microbiology Services Colindale, Public Health England, EPI_ISL_415147, 
England/20099107406/2020, S: L5F, A2a, England, United Kingdom, C21575T, 2020.1625683060108, Respiratory Virus Unit, Microbiology Services Colindale, Public Health England, Respiratory Virus Unit, Microbiology Services Colindale, Public Health England, EPI_ISL_415131, 
NODE_0000250, , A2a, England, , , 2020.1438317658533, , , , 
NODE_0000605, N: A156S, A2a, North Brabant, , G28739T, 2020.170214142624, , , , 
Netherlands/NoordBrabant_17/2020, , A2a, North Brabant, Netherlands, C7063T, 2020.1789617486338, Dutch COVID-19 response team, Erasmus Medical Center, EPI_ISL_414457, 
Netherlands/NoordBrabant_4/2020, ORF1b: A2006V, A2a, North Brabant, Netherlands, C19484T, 2020.1789617486338, Dutch COVID-19 response team, Erasmus Medical Center, EPI_ISL_414450, 
NODE_0000253, , A2a, Geneva, , , 2020.157086287371, , , , 
Switzerland/GE4984/2020, N: S188L; ORF14: H35Y; ORF1b: T132I, A2a, Geneva, Switzerland, C13862T; C28836T, 2020.181693989071, Hopitaux universitaires de Geneve Laboratoire de Virologie, Hopitaux universitaires de Geneve Laboratoire de Virologie, EPI_ISL_415708, 
Wales/PHW27/2020, ORF1b: P976S; ORF6: E55D; S: V341I, A2a, Wales, United Kingdom, C16393T; G22583A; G27366T, 2020.1953551912568, Wales Specialist Virology Centre, Public Health Wales Microbiology Cardiff, EPI_ISL_415655, 
NODE_0000481, , A2a, England, , , 2020.1241417844572, , , , 
NODE_0000482, , A2a, England, , , 2020.1316859602086, , , , 
NODE_0000483, , A2a, England, , , 2020.1336795855036, , , , 
NorthernIreland/HSCNI01/2020, , A2a, Northern Ireland, United Kingdom, C7420T, 2020.1543715846994, Regional Virus Laboratory, Belfast, Public Health Wales Microbiology Cardiff, EPI_ISL_414949, 
NODE_0000579, S: P1263L, A2a, England, , C25350T, 2020.1423826762173, , , , 
NODE_0000583, ORF1b: D2323Y, A2a, England, , G20434T; C26858T, 2020.1625683060108, , , , 
England/20100121006/2020, , A2a, England, United Kingdom, , 2020.1625683060108, Respiratory Virus Unit, Microbiology Services Colindale, Public Health England, Respiratory Virus Unit, Microbiology Services Colindale, Public Health England, EPI_ISL_415140, 
England/20100121007/2020, , A2a, England, United Kingdom, , 2020.1625683060108, Respiratory Virus Unit, Microbiology Services Colindale, Public Health England, Respiratory Virus Unit, Microbiology Services Colindale, Public Health England, EPI_ISL_415141, 
NODE_0000487, , A2a, England, , , 2020.1492838931222, , , , 
England/20100005406/2020, , A2a, England, United Kingdom, , 2020.1598360655737, Respiratory Virus Unit, Microbiology Services Colindale, Public Health England, Respiratory Virus Unit, Microbiology Services Colindale, Public Health England, EPI_ISL_415135, 
NODE_0000488, , A2a, England, , , 2020.151608259491, , , , 
England/20100004706/2020, , A2a, England, United Kingdom, , 2020.1625683060108, Respiratory Virus Unit, Microbiology Services Colindale, Public Health England, Respiratory Virus Unit, Microbiology Services Colindale, Public Health England, EPI_ISL_415133, 
NODE_0000489, , A2a, England, , , 2020.1537603617905, , , , 
England/20100004806/2020, , A2a, England, United Kingdom, , 2020.1625683060108, Respiratory Virus Unit, Microbiology Services Colindale, Public Health England, Respiratory Virus Unit, Microbiology Services Colindale, Public Health England, EPI_ISL_415134, 
NODE_0000490, , A2a, England, , , 2020.1571038251366, , , , 
England/200990660/2020, , A2a, England, United Kingdom, , 2020.1571038251366, Respiratory Virus Unit, Microbiology Services Colindale, Public Health England, Respiratory Virus Unit, Microbiology Services Colindale, Public Health England, EPI_ISL_414523, 
NODE_0000491, , A2a, England, , , 2020.1701261527674, , , , 
England/201040141/2020, , A2a, England, United Kingdom, , 2020.1707650273224, Respiratory Virus Unit, Microbiology Services Colindale, Public Health England, Respiratory Virus Unit, Microbiology Services Colindale, Public Health England, EPI_ISL_414526, 
Scotland/EDB011/2020, , A2a, Scotland, United Kingdom, , 2020.1734972677596, Virology Department, Royal Infirmary of Edinburgh, NHS Lothian, Virology Department, Royal Infirmary of Edinburgh, NHS Lothian, EPI_ISL_415637, 
NODE_0000492, , A2a, England, , , 2020.1323741896758, , , , 
NODE_0000493, , A2a, Lombardy, , , 2020.1379781420765, , , , 
Italy/CDG1/2020, , A2a, Lombardy, Italy, , 2020.1379781420765, Department of Infectious Diseases, Istituto Superiore di Sanita, Roma , Italy, Virology Laboratory, Scientific Department, Army Medical Center, EPI_ISL_412973, 
NODE_0000575, , A2a, South Holland, , A24862G, 2020.1592462507635, , , , 
Netherlands/ZuidHolland_31/2020, N: A119V, A2a, South Holland, Netherlands, T658C; C28629T, 2020.1953551912568, Dutch COVID-19 response team, Erasmus Medical Center, EPI_ISL_415535, 
Netherlands/NA_31/2020, N: D402Y; ORF7b: E39*, A2a, Netherlands, Netherlands, G27870T; G29477T, 2020.198087431694, Dutch COVID-19 response team, Erasmus Medical Center, EPI_ISL_415488, 
NODE_0000495, , A2a, North Brabant, , , 2020.1683433989042, , , , 
Netherlands/NoordBrabant_21/2020, , A2a, North Brabant, Netherlands, , 2020.1734972677596, Dutch COVID-19 response team, Erasmus Medical Center, EPI_ISL_414530, 
NODE_0000496, , A2a, North Brabant, , , 2020.1703028949842, , , , 
Netherlands/NoordBrabant_13/2020, , A2a, North Brabant, Netherlands, , 2020.1789617486338, Dutch COVID-19 response team, Erasmus Medical Center, EPI_ISL_414453, 
Netherlands/Gelderland/2/2020, , A2a, Gelderland, Netherlands, , 2020.1871584699454, Dutch COVID-19 response team, Erasmus Medical Center, EPI_ISL_415462, 
NODE_0000497, , A2a, Sao Paulo, , , 2020.1416571045395, , , , 
NODE_0000499, , A2a, Sao Paulo, , , 2020.1515392831263, , , , 
NODE_0000500, , A2a, Netherlands, , , 2020.1701299995543, , , , 
USA/CA-PC101P/2020, , A2a, California, USA, C18814T, 2020.1926229508197, Andersen Lab, The Scripps Research Institute, Andersen Lab, The Scripps Research Institute, EPI_ISL_414648, MT192765
Netherlands/NA/16/2020, ORF1b: D2270N, A2a, Netherlands, Netherlands, G20275A, 2020.1926229508197, Dutch COVID-19 response team, Erasmus Medical Center, EPI_ISL_415472, 
NODE_0000501, , A2a, Sao Paulo, , , 2020.156911689329, , , , 
NODE_0000502, , A2a, Flevoland, , , 2020.1680327868853, , , , 
Netherlands/Zeewolde_1365080/2020, , A2a, Flevoland, Netherlands, , 2020.1680327868853, MHC Flevoland, Erasmus Medical Center, EPI_ISL_413591, 
Netherlands/Utrecht_11/2020, , A2a, Utrecht, Netherlands, , 2020.1707650273224, Dutch COVID-19 response team, Erasmus Medical Center, EPI_ISL_414443, 
NODE_0000503, , A2a, Sao Paulo, , , 2020.1619916957857, , , , 
Brazil/SPBR-06/2020, , A2a, Sao Paulo, Brazil, , 2020.1625683060108, Hospital Sao Joaquim Beneficencia Portuguesa, Instituto Adolfo Lutz, Interdiciplinary Procedures Center, Strategic Laboratory, EPI_ISL_414015, 
Brazil/SPBR-05/2020, , A2a, Sao Paulo, Brazil, , 2020.1625683060108, Hospital Sao Joaquim Beneficencia Portuguesa, Instituto Adolfo Lutz, Interdiciplinary Procedures Center, Strategic Laboratory, EPI_ISL_414016, 
NODE_0000504, , A2a, Sao Paulo, , , 2020.1519419104297, , , , 
NODE_0000505, , A2a, Limerick, , , 2020.1571038251366, , , , 
Ireland/Limerick-19933/2020, , A2a, Limerick, Ireland, , 2020.1707650273224, UCD National Virus Reference Laboratory, UCD National Virus Reference Laboratory, EPI_ISL_414585, 
Wales/PHW1/2020, , A2a, Wales, United Kingdom, , 2020.1571038251366, Wales Specialist Virology Centre, Public Health Wales Microbiology Cardiff, EPI_ISL_413555, 
NODE_0000506, , A2a, Sao Paulo, , , 2020.157091868291, , , , 
NODE_0000507, , A2a, Sao Paulo, , , 2020.1701261527674, , , , 
France/GE1973/2020, , A2a, Grand Est, France, , 2020.1734972677596, Hopital Robert Debre Laboratoire de Virologie, National Reference Center for Viruses of Respiratory Infections, Institut Pasteur, Paris, EPI_ISL_414631, 
Brazil/SPBR-09/2020, , A2a, Sao Paulo, Brazil, , 2020.1734972677596, National Influenza Center - Instituto Adolfo Lutz, Instituto Adolfo Lutz, Interdiciplinary Procedures Center, Strategic Laboratory, EPI_ISL_416031, 
NODE_0000508, , A2a, Scotland, , , 2020.169664020429, , , , 
Georgia/Tb-477/2020, , A2a, Tbilisi, Georgia, , 2020.1898907103825, R. G. Lugar Center for Public Health Research,  National Center for Disease Control and Public Health (NCDC) of Georgia., R. G. Lugar Center for Public Health Research,  National Center for Disease Control and Public Health (NCDC) of Georgia., EPI_ISL_415642, 
Scotland/EDB004/2020, , A2a, Scotland, United Kingdom, , 2020.1734972677596, Virology Department, Royal Infirmary of Edinburgh, NHS Lothian, Virology Department, Royal Infirmary of Edinburgh, NHS Lothian, EPI_ISL_415629, 
NODE_0000509, , A2a, England, , , 2020.131203044395, , , , 
NODE_0000511, , A2a, England, , , 2020.1398003619936, , , , 
NODE_0000542, , A2a, Scotland, , C23575T, 2020.1571332157687, , , , 
Luxembourg/Lux1/2020, , A2a, Luxembourg, Luxembourg, , 2020.1625683060108, Laboratoire National de Sante, Erasmus Medical Center, EPI_ISL_413593, 
NODE_0000543, S: Q675H, A2a, Scotland, , G23587C, 2020.1670119233193, , , , 
Scotland/EDB013/2020, , A2a, Scotland, United Kingdom, , 2020.1898907103825, Virology Department, Royal Infirmary of Edinburgh, NHS Lothian, Virology Department, Royal Infirmary of Edinburgh, NHS Lothian, EPI_ISL_415639, 
NODE_0000290, , A2a, Scotland, , , 2020.1707650273224, , , , 
Scotland/EDB003/2020, , A2a, Scotland, United Kingdom, , 2020.1844262295083, Virology Department, Royal Infirmary of Edinburgh, NHS Lothian, Virology Department, Royal Infirmary of Edinburgh, NHS Lothian, EPI_ISL_415640, 
Denmark/SSI-101/2020, , A2a, Scotland, Italy, , 2020.1707650273224, Department of Virus and Microbiological Special diagnostics, Statens Serum Institut, Copenhagen, Denmark., ViFU, EPI_ISL_415646, 
NODE_0000514, , A2a, England, , , 2020.1514699685538, , , , 
NODE_0000515, , A2a, England, , , 2020.158480718176, , , , 
NODE_0000516, , A2a, Scotland, , , 2020.1653005464482, , , , 
Scotland/CVR03/2020, , A2a, Scotland, United Kingdom, , 2020.1653005464482, West of Scotland Specialist Virology Centre, NHSGGC, MRC-University of Glasgow Centre for Virus Research, EPI_ISL_414025, 
Denmark/SSI-09/2020, , A2a, Copenhagen, Denmark, , 2020.1707650273224, Department of Virus and Microbiological Special diagnostics, Statens Serum Institut, Copenhagen, Denmark., Statens Serum Institute, EPI_ISL_416141, 
NODE_0000517, , A2a, England, , , 2020.1653005464482, , , , 
CzechRepublic/951/2020_travel_history, , , Italy, , , 2020.1653005464482, , , , 
CzechRepublic/951/2020, , A2a, Usti nad Labem, Czech Republic, , 2020.1653005464482, The National Institute of Public Health Center for Epidemiology and Microbiology, State Veterinary Institute Prague, EPI_ISL_414477, 
England/201040081/2020, , A2a, England, United Kingdom, , 2020.1680327868853, Respiratory Virus Unit, Microbiology Services Colindale, Public Health England, Respiratory Virus Unit, Microbiology Services Colindale, Public Health England, EPI_ISL_414525, 
NODE_0000518, , A2a, North Brabant, , , 2020.159441432368, , , , 
NODE_0000519, , A2a, North Brabant, , , 2020.1701261527674, , , , 
