Netherlands/Tilburg_1363354/2020, ORF1a: I2538S; ORF1b: R1315C, unassigned, North Brabant, Netherlands, T7878G; C17410T, 2020.1571038251366, Foundation Elisabeth-Tweesteden Ziekenhuis, Erasmus Medical Center, EPI_ISL_413586, 
NODE_0000190, , unassigned, North Brabant, , , 2020.1625683060108, , , , 
Netherlands/Oss_1363500/2020, , unassigned, North Brabant, Netherlands, , 2020.1625683060108, RIVM, Erasmus Medical Center, EPI_ISL_413581, 
Netherlands/Nieuwendijk_1363582/2020, , unassigned, North Brabant, Netherlands, , 2020.1653005464482, ErasmusMC, Erasmus Medical Center, EPI_ISL_413578, 
NODE_0000537, , A6, North Brabant, , T514C, 2020.0387370140713, , , , 
Guangdong/GDSZ202004-P0004/2020, , A6, Guangdong, China, A18114G; C26370T; C26388T, 2020.0969945355191, Guangdong Provincial Institution of Public Health, Guangdong Provinical Center for Disease Control and Prevention, Guangdong Provincial Institution of Public Health, EPI_ISL_413879, 
NODE_0000193, , A6, North Brabant, , , 2020.0580859225104, , , , 
NODE_0000194, , A6, North Brabant, , , 2020.075000514264, , , , 
Netherlands/Utrecht_19/2020, ORF1b: V2178F, A6, Utrecht, Netherlands, C5512T; G19999T; C29144T, 2020.1953551912568, Dutch COVID-19 response team, Erasmus Medical Center, EPI_ISL_415528, 
NODE_0000233, ORF1a: G645S, A6, North Brabant, , G2198A, 2020.1530947437302, , , , 
Netherlands/NoordBrabant_29/2020, , A6, North Brabant, Netherlands, , 2020.1844262295083, Dutch COVID-19 response team, Erasmus Medical Center, EPI_ISL_414538, 
NODE_0000234, ORF1a: A1997V, A6, North Brabant, , C6255T, 2020.1679454437317, , , , 
Netherlands/NoordBrabant_35/2020, ORF1b: R1315C, A6, North Brabant, Netherlands, C10456T; C17410T, 2020.1871584699454, Dutch COVID-19 response team, Erasmus Medical Center, EPI_ISL_414544, 
Netherlands/NoordBrabant_32/2020, ORF1a: V2133I; ORF1b: L1099F, T1173I, A6, North Brabant, Netherlands, G6662A; C16762T; C16985T, 2020.1844262295083, Dutch COVID-19 response team, Erasmus Medical Center, EPI_ISL_414541, 
Netherlands/NoordBrabant_31/2020, , A6, North Brabant, Netherlands, C29719T, 2020.1844262295083, Dutch COVID-19 response team, Erasmus Medical Center, EPI_ISL_414540, 
NODE_0000197, , A6, North Brabant, , , 2020.0597769747494, , , , 
NODE_0000198, , A6, North Brabant, , , 2020.0724043715848, , , , 
USA/CA6/2020_travel_history, , , Hubei, , , 2020.0724043715848, , , , 
USA/CA6/2020, , A6, California, USA, , 2020.0724043715848, California Department of Public Health, Pathogen Discovery, Respiratory Viruses Branch, Division of Viral Diseases, Centers for Disease Control and Prevention, EPI_ISL_410044, MT044258
NODE_0000231, ORF1a: A1997V, A6, North Brabant, , C6255T, 2020.170415603405, , , , 
Netherlands/NoordBrabant_27/2020, ORF1b: R1315C, A6, North Brabant, Netherlands, C17410T, 2020.1844262295083, Dutch COVID-19 response team, Erasmus Medical Center, EPI_ISL_414536, 
Netherlands/NoordBrabant_28/2020, , A6, North Brabant, Netherlands, , 2020.1844262295083, Dutch COVID-19 response team, Erasmus Medical Center, EPI_ISL_414537, 
Netherlands/NoordBrabant_30/2020, , A6, North Brabant, Netherlands, G25252T, 2020.1844262295083, Dutch COVID-19 response team, Erasmus Medical Center, EPI_ISL_414539, 
NODE_0000200, , A6, North Brabant, , , 2020.0742856959253, , , , 
NODE_0000201, , A6, North Brabant, , , 2020.0767458533148, , , , 
Netherlands/Limburg_6/2020, S: R765L, A6, Limburg, Netherlands, G3403A; G23856T, 2020.1707650273224, Dutch COVID-19 response team, Erasmus Medical Center, EPI_ISL_414427, 
NODE_0000217, ORF1a: H1500Y, A6, North Brabant, , C4763T, 2020.1680327868853, , , , 
Netherlands/NoordBrabant_10/2020, , A6, North Brabant, Netherlands, , 2020.1680327868853, Dutch COVID-19 response team, Erasmus Medical Center, EPI_ISL_414431, 
Netherlands/NoordBrabant_12/2020, N: K373N, A6, North Brabant, Netherlands, G29392T, 2020.1789617486338, Dutch COVID-19 response team, Erasmus Medical Center, EPI_ISL_414452, 
NODE_0000203, , A6, North Brabant, , , 2020.1323162970182, , , , 
NODE_0000204, , A6, North Brabant, , , 2020.1418411546972, , , , 
NODE_0000205, , A6, North Brabant, , , 2020.1537011616854, , , , 
NODE_0000206, , A6, North Brabant, , , 2020.1653005464482, , , , 
Netherlands/Rotterdam_1364040/2020, , A6, South Holland, Netherlands, , 2020.1680327868853, MHC Rotterdam-Rijnmond, Erasmus Medical Center, EPI_ISL_413583, 
Netherlands/Andel_1365066/2020, , A6, North Brabant, Netherlands, , 2020.1653005464482, MHC West-Brabant, Erasmus Medical Center, EPI_ISL_413564, 
NODE_0000207, , A6, North Brabant, , , 2020.1701314707225, , , , 
Netherlands/NA/22/2020, ORF1a: V3017F, A6, Netherlands, Netherlands, G9314T, 2020.1844262295083, Dutch COVID-19 response team, Erasmus Medical Center, EPI_ISL_415479, 
Netherlands/NoordBrabant_48/2020, , A6, North Brabant, Netherlands, T3541C, 2020.1926229508197, Dutch COVID-19 response team, Erasmus Medical Center, EPI_ISL_415505, 
NODE_0000208, , A6, North Brabant, , , 2020.1523199627688, , , , 
NODE_0000209, , A6, Scotland, , , 2020.1680327868853, , , , 
Netherlands/Naarden_1364774/2020, , A6, North Holland, Netherlands, , 2020.1680327868853, MHC Gooi & Vechtstreek, Erasmus Medical Center, EPI_ISL_413577, 
Scotland/CVR02/2020, , A6, Scotland, United Kingdom, , 2020.1680327868853, West of Scotland Specialist Virology Centre, NHSGGC, MRC-University of Glasgow Centre for Virus Research, EPI_ISL_414024, 
NODE_0000226, ORF1b: L1099F, A6, North Brabant, , C16762T, 2020.1616219546459, , , , 
Netherlands/NoordBrabant_54/2020, , A6, North Brabant, Netherlands, G1018A, 2020.1871584699454, Dutch COVID-19 response team, Erasmus Medical Center, EPI_ISL_415510, 
NODE_0000211, , A6, North Brabant, , , 2020.1680327868853, , , , 
Netherlands/NoordBrabant_11/2020, , A6, North Brabant, Netherlands, , 2020.1680327868853, Dutch COVID-19 response team, Erasmus Medical Center, EPI_ISL_414432, 
Netherlands/Hardinxveld_Giessendam_1364806/2020, , A6, South Holland, Netherlands, , 2020.1680327868853, Dienst Gezondheid & Jeugd Zuid-Holland Zuid, Erasmus Medical Center, EPI_ISL_413573, 
NODE_0000212, , A6, North Brabant, , , 2020.1343924228433, , , , 
NODE_0000213, , A6, North Brabant, , , 2020.1537189071253, , , , 
Netherlands/NoordBrabant_47/2020, ORF1b: Q866H, A6, North Brabant, Netherlands, G16065T; C17373T, 2020.1871584699454, Dutch COVID-19 response team, Erasmus Medical Center, EPI_ISL_415504, 
NODE_0000214, , A6, Scotland, , , 2020.1701261527674, , , , 
Scotland/EDB012/2020, , A6, Scotland, United Kingdom, , 2020.181693989071, Virology Department, Royal Infirmary of Edinburgh, NHS Lothian, Virology Department, Royal Infirmary of Edinburgh, NHS Lothian, EPI_ISL_415638, 
Scotland/CVR04/2020, , A6, Scotland, United Kingdom, , 2020.1734972677596, West of Scotland Specialist Virology Centre, NHSGGC, MRC-University of Glasgow Centre for Virus Research, EPI_ISL_414026, 
NODE_0000215, , A6, North Brabant, , , 2020.1431937785687, , , , 
NODE_0000216, , A6, Netherlands, , , 2020.1701261527674, , , , 
Netherlands/NA_32/2020, , A6, Netherlands, Netherlands, , 2020.198087431694, Dutch COVID-19 response team, Erasmus Medical Center, EPI_ISL_415489, 
England/Sheff01/2020, , A6, England, United Kingdom, , 2020.1734972677596, Virology Department, Sheffield Teaching Hospitals NHS Foundation Trust, Department of Infection, Immunity and Cardiovascular Disease, The Florey Institute,  The Medical School, University of Sheffield, EPI_ISL_414500, 
NODE_0000199, ORF1b: R1315C, A6, North Brabant, , C17410T, 2020.1519845810883, , , , 
Netherlands/NoordBrabant_42/2020, ORF7a: E121*, A6, North Brabant, Netherlands, G27754T, 2020.1898907103825, Dutch COVID-19 response team, Erasmus Medical Center, EPI_ISL_415500, 
Netherlands/NA_33/2020, N: A336V; S: T1273I, A6, Netherlands, Netherlands, C25380T; C29280T, 2020.181693989071, Dutch COVID-19 response team, Erasmus Medical Center, EPI_ISL_415490, 
NODE_0000564, , A6, North Brabant, , , 2020.1539498695727, , , , 
Netherlands/Loon_op_zand_1363512/2020, , A6, North Brabant, Netherlands, , 2020.1625683060108, RIVM, Erasmus Medical Center, EPI_ISL_413576, 
NODE_0000218, , A6, North Brabant, , , 2020.1579880927263, , , , 
NODE_0000219, , A6, North Brabant, , , 2020.1593989108862, , , , 
Netherlands/NoordBrabant_38/2020, , A6, North Brabant, Netherlands, , 2020.1789617486338, Dutch COVID-19 response team, Erasmus Medical Center, EPI_ISL_414547, 
NODE_0000220, , A6, North Brabant, , , 2020.1652154389312, , , , 
Netherlands/Dalen_1363624/2020, , A6, Drenthe, Netherlands, , 2020.1653005464482, MHC Drente, Erasmus Medical Center, EPI_ISL_413568, 
NODE_0000221, , A6, North Brabant, , , 2020.1677731519449, , , , 
Netherlands/NoordBrabant_68/2020, , A6, North Brabant, Netherlands, , 2020.1953551912568, Dutch COVID-19 response team, Erasmus Medical Center, EPI_ISL_415524, 
NODE_0000222, , A6, North Brabant, , , 2020.170109860381, , , , 
Netherlands/NoordBrabant_18/2020, , A6, North Brabant, Netherlands, , 2020.1762295081967, Dutch COVID-19 response team, Erasmus Medical Center, EPI_ISL_414458, 
USA/MN2-MDH2/2020, , A6, Minnesota, USA, , 2020.181693989071, Minnesota Department of Health, Public Health Laboratory, Minnesota Department of Health, Public Health Laboratory, EPI_ISL_414589, MT188340
NODE_0000223, , A6, North Brabant, , , 2020.1590427161755, , , , 
Netherlands/NoordBrabant_19/2020, , A6, North Brabant, Netherlands, , 2020.1789617486338, Dutch COVID-19 response team, Erasmus Medical Center, EPI_ISL_414459, 
NODE_0000224, , A6, North Brabant, , , 2020.1674884462454, , , , 
Netherlands/NoordBrabant_24/2020, , A6, North Brabant, Netherlands, , 2020.1789617486338, Dutch COVID-19 response team, Erasmus Medical Center, EPI_ISL_414533, 
NODE_0000225, , A6, North Brabant, , , 2020.1680644235357, , , , 
Netherlands/NoordBrabant_57/2020, , A6, North Brabant, Netherlands, , 2020.1926229508197, Dutch COVID-19 response team, Erasmus Medical Center, EPI_ISL_415513, 
NODE_0000227, , A6, North Brabant, , , 2020.1690606971763, , , , 
Netherlands/NoordBrabant_49/2020, , A6, North Brabant, Netherlands, , 2020.1926229508197, Dutch COVID-19 response team, Erasmus Medical Center, EPI_ISL_415506, 
NODE_0000228, , A6, North Brabant, , , 2020.1703028949842, , , , 
Netherlands/NoordBrabant_44/2020, , A6, North Brabant, Netherlands, , 2020.1926229508197, Dutch COVID-19 response team, Erasmus Medical Center, EPI_ISL_415501, 
Netherlands/NoordBrabant_52/2020, , A6, North Brabant, Netherlands, , 2020.1871584699454, Dutch COVID-19 response team, Erasmus Medical Center, EPI_ISL_415508, 
NODE_0000587, , unassigned, Hubei, , , 2019.963789397144, , , , 
NODE_0000588, , unassigned, Hubei, , , 2019.9722493134054, , , , 
NODE_0000589, , unassigned, Hubei, , , 2020.0155794612258, , , , 
NODE_0000334, , unassigned, Hubei, , G29449T, 2020.0391551534715, , , , 
Hangzhou/ZJU-06/2020, ORF1a: P1207H, unassigned, Zhejiang, China, C3885A; C12778T; T13270C, 2020.0887978142077, State Key Laboratory for Diagnosis and Treatment of Infectious Diseases, National Clinical Research Center for Infectious Diseases, First Affiliated Hospital, Zhejiang University School of Medicine, Hangzhou, China 310003, State Key Laboratory for Diagnosis and Treatment of Infectious Diseases, National Clinical Research Center for Infectious Diseases, First Affiliated Hospital, Zhejiang University School of Medicine, Hangzhou, China 310003, EPI_ISL_416047, 
Australia/NSW02/2020, ORF1a: L2688F, unassigned, New South Wales, Australia, C8327T, 2020.058743169399, Centre for Infectious Diseases and Microbiology Laboratory Services, NSW Health Pathology - Institute of Clinical Pathology and Medical Research; Westmead Hospital; University of Sydney, EPI_ISL_408976, 
NODE_0000176, N: S194L; ORF14: Q41*, unassigned, Hubei, , C28854T, 2020.0335474044373, , , , 
Foshan/20SF207/2020, ORF9b: P3L, unassigned, Guangdong, China, C28291T, 2020.058743169399, Guangdong Provincial Center for Diseases Control and Prevention; Guangdong Provincial Public Health, Guangdong Provincial Center for Diseases Control and Prevention, EPI_ISL_406534, 
Shenzhen/SZTH-003/2020, ORF7a: Q62*, unassigned, Guangdong, China, C27577T, 2020.042349726776, Shenzhen Key Laboratory of Pathogen and Immunity, National Clinical Research Center for Infectious Disease, Shenzhen Third People's Hospital, Shenzhen Key Laboratory of Pathogen and Immunity, National Clinical Research Center for Infectious Disease, Shenzhen Third People's Hospital, EPI_ISL_406594, 
NODE_0000178, ORF1a: I1607V, unassigned, Hubei, , A5084G, 2020.0534554307412, , , , 
Canada/ON-VIDO-01/2020_travel_history, , , Hubei, , , 2020.061475409836, , , , 
Canada/ON-VIDO-01/2020, E: S6L, unassigned, Ontario, Canada, C26261T, 2020.061475409836, Public Health Ontario Laboratory, National Microbiology Laboratory, EPI_ISL_413015, 
Canada/ON-PHL2445/2020_travel_history, , , Hubei, , , 2020.0669398907103, , , , 
Canada/ON-PHL2445/2020, , unassigned, Ontario, Canada, , 2020.0669398907103, Public Health Ontario Laboratory, Ontario Agency for Health Protection and Promotion (OAHPP), EPI_ISL_413014, 
NODE_0000180, ORF1a: A117T, unassigned, California, , G614A, 2020.077868852459, , , , 
USA/CA3/2020, , unassigned, California, USA, , 2020.077868852459, California Department of Health, Pathogen Discovery, Respiratory Viruses Branch, Division of Viral Diseases, Centers for Disease Control and Prevention, EPI_ISL_408008, MT027062
USA/CA4/2020, , unassigned, California, USA, , 2020.077868852459, California Department of Health, Pathogen Discovery, Respiratory Viruses Branch, Division of Viral Diseases, Centers for Disease Control and Prevention, EPI_ISL_408009, MT027063
NODE_0000594, , unassigned, Hubei, , , 2020.0072287517748, , , , 
Guangdong/2020XN4373-P0039/2020, ORF1a: I476V, unassigned, Guangdong, China, C274T; A1691G; C29518T, 2020.0806010928961, Guangdong Provincial Institution of Public Health, Guangdong Provinical Center for Disease Control and Prevention, Guangdong Provincial Institution of Public Health, EPI_ISL_413851, 
NODE_0000404, ORF3a: G251V, unassigned, Hubei, , G26144T, 2020.0316588484238, , , , 
Taiwan/2/2020, ORF1b: W907C; ORF3a: E191G, unassigned, Taiwan, Taiwan, G16188T; A25964G, 2020.061475409836, Centers for Disease Control, R.O.C. (Taiwan), Centers for Disease Control, R.O.C. (Taiwan), EPI_ISL_406031, 
Sweden/01/2020, ORF1a: G818S, F4321L; S: F797C, unassigned, Smland, Sweden, G2717A; A9274G; C13225G; T13226C; A17376G; T23952G, 2020.1024590163934, , Unit for Laboratory Development and Technology Transfer, Public Health Agency of Sweden, EPI_ISL_411951, MT093571
Australia/VIC01/2020_travel_history, , , Hubei, , , 2020.0669398907103, , , , 
Australia/VIC01/2020, S: S247R, unassigned, Victoria, Australia, T19065C; T22303G, 2020.0669398907103, Monash Medical Centre, Collaboration between the University of Melbourne at The Peter Doherty Institute for Infection and Immunity, and the Victorian Infectious Disease Reference Laboratory, EPI_ISL_406844, MT007544
NODE_0000406, M: A40S, I52T, unassigned, South Korea, , G26640T; T26677C, 2020.0586448747385, , , , 
SouthKorea/KUMC02/2020, , unassigned, South Korea, South Korea, A2707G, 2020.0997267759562, Department of Microbiology, Institute for Viral Diseases, College of Medicine, Korea University, Department of Microbiology, Institute for Viral Diseases, College of Medicine, Korea University, EPI_ISL_413018, 
SouthKorea/KUMC01/2020, ORF1a: L1599F; ORF8: L84S, unassigned, South Korea, South Korea, T4402C; G5062T; T28144C, 2020.0997267759562, Department of Microbiology, Institute for Viral Diseases, College of Medicine, Korea University, Department of Microbiology, Institute for Viral Diseases, College of Medicine, Korea University, EPI_ISL_413017, 
NODE_0000232, , unassigned, Hubei, , , 2020.033838123682, , , , 
NODE_0000235, , unassigned, Singapore, , , 2020.0340679973144, , , , 
NODE_0000236, , unassigned, Singapore, , , 2020.0415368205433, , , , 
NODE_0000237, , unassigned, Singapore, , , 2020.0583612888329, , , , 
Guangdong/GD2020087-P0008/2020, S: Q409E, unassigned, Guangdong, China, C22787G, 2020.0860655737704, Guangdong Provincial Institution of Public Health, Guangdong Provinical Center for Disease Control and Prevention, Guangdong Provincial Institution of Public Health, EPI_ISL_413863, 
Singapore/8/2020, , unassigned, Singapore, Singapore, C21859T, 2020.0915300546449, National Public Health Laboratory, National Centre for Infectious Diseases, National Public Health Laboratory, National Centre for Infectious Diseases, EPI_ISL_410714, 
NODE_0000238, , unassigned, Singapore, , , 2020.0500000324669, , , , 
USA/CA2/2020_travel_history, , , Hubei, , , 2020.058743169399, , , , 
USA/CA2/2020, ORF1b: T1178I, unassigned, California, USA, C17000T, 2020.058743169399, California Department of Public Health, Pathogen Discovery, Respiratory Viruses Branch, Division of Viral Diseases, Centers for Disease Control and Prevention, EPI_ISL_406036, MN994468
NODE_0000239, , unassigned, Singapore, , , 2020.0592480693792, , , , 
Australia/NSW03/2020, , unassigned, New South Wales, Australia, , 2020.0669398907103, Serology, Virology and OTDS Laboratories (SAViD), NSW Health Pathology Randwick, NSW Health Pathology - Institute of Clinical Pathology and Medical Research; Centre for Infectious Diseases and Microbiology Laboratory Services; Westmead Hospital; University of Sydney, EPI_ISL_408977, 
NODE_0000426, , unassigned, Singapore, , C10138T, 2020.0774067201207, , , , 
Singapore/5/2020, , unassigned, Singapore, Singapore, , 2020.0997267759562, Singapore General Hospital, Molecular Laboratory, Division of Pathology, Programme in Emerging Infectious Diseases, Duke-NUS Medical School, EPI_ISL_410536, 
Singapore/9/2020, , unassigned, Singapore, Singapore, , 2020.094262295082, National Public Health Laboratory, National Centre for Infectious Diseases, National Public Health Laboratory, National Centre for Infectious Diseases, EPI_ISL_410715, 
Singapore/10/2020, , unassigned, Singapore, Singapore, , 2020.094262295082, National Public Health Laboratory, National Centre for Infectious Diseases, National Centre for Infectious Diseases, National Centre for Infectious Diseases, EPI_ISL_410716, 
NODE_0000242, , unassigned, Singapore, , , 2020.0392266890801, , , , 
NODE_0000243, , unassigned, Singapore, , , 2020.0468003552144, , , , 
Singapore/7/2020, ORF14: T39I, unassigned, Singapore, Singapore, C28849T, 2020.0724043715848, National Public Health Laboratory, National Centre for Infectious Diseases, National Public Health Laboratory, National Centre for Infectious Diseases, EPI_ISL_410713, 
NODE_0000424, S: V367F, unassigned, Ile de France, , G22661T, 2020.0577223058328, , , , 
France/IDF0372/2020, , unassigned, Ile de France, France, , 2020.061475409836, Department of Infectious and Tropical Diseases, Bichat Claude Bernard Hospital, Paris, National Reference Center for Viruses of Respiratory Infections, Institut Pasteur, Paris, EPI_ISL_406596, 
NODE_0000647, , unassigned, Ile de France, , , 2020.061475409836, , , , 
France/IDF0386-islP1/2020, , unassigned, Ile de France, France, , 2020.0751366120219, Department of Infectious and Tropical Diseases, Bichat Claude Bernard Hospital, Paris, Laboratoire Virpath, CIRI U111, UCBL1, INSERM, CNRS, ENS Lyon, EPI_ISL_411219, 
France/IDF0373/2020, , unassigned, Ile de France, France, , 2020.061475409836, Department of Infectious and Tropical Diseases, Bichat Claude Bernard Hospital, Paris, National Reference Center for Viruses of Respiratory Infections, Institut Pasteur, Paris, EPI_ISL_406597, 
NODE_0000410, , unassigned, Hong Kong, , T13929C, 2020.0588351807753, , , , 
HongKong/case42_VM20002493/2020, N: M322I; S: T719A, unassigned, Hong Kong, Hong Kong, A23717G; G29239T, 2020.1079234972678, Hong Kong Department of Health, School of Public Health, The University of Hong Kong, EPI_ISL_414527, 
NODE_0000248, , unassigned, Hong Kong, , , 2020.068008997804, , , , 
HongKong/case52_VM20002582/2020, , unassigned, Hong Kong, Hong Kong, G25500A, 2020.1161202185792, Hong Kong Department of Health, School of Public Health, The University of Hong Kong, EPI_ISL_414569, 
NODE_0000249, , unassigned, Hong Kong, , , 2020.077229977904, , , , 
HongKong/case48_VM20002507/2020, , unassigned, Hong Kong, Hong Kong, , 2020.110655737705, Hong Kong Department of Health, School of Public Health, The University of Hong Kong, EPI_ISL_414528, 
HongKong/VB20024950/2020, , unassigned, Hong Kong, Hong Kong, , 2020.0806010928961, Hong Kong Department of Health, The University of Hong Kong, EPI_ISL_412029, 
NODE_0000414, ORF1a: E444K, H3233Y; S: L8V, unassigned, Hong Kong, , G1595A; C9962T; C11704T; C14724T; T21584G, 2020.1336481426636, , , , 
canine/HongKong/20-02756/2020, ORF1a: D2101G; ORF1b: K1828R, unassigned, Hong Kong, Hong Kong, A6567G; A18950G; C29730T, 2020.1543715846994, Tai Lung Veterinary Laboratory, Agriculture, Fisheries and Conservation Department, School of Public Health, The University of Hong Kong, EPI_ISL_414518, 
NODE_0000251, , unassigned, Hong Kong, , , 2020.1418751478197, , , , 
Canada/BC_35720/2020_travel_history, , , Hong Kong, , , 2020.1734972677596, , , , 
Canada/BC_35720/2020, , unassigned, British Columbia, Canada, A3790G, 2020.1734972677596, BCCDC Public Health Laboratory, BCCDC Public Health Laboratory, EPI_ISL_415582, 
NODE_0000252, , unassigned, Hong Kong, , , 2020.1489071038252, , , , 
HongKong/case90_VM20002907/2020, , unassigned, Hong Kong, Hong Kong, , 2020.1516393442623, Hong Kong Department of Health, School of Public Health, The University of Hong Kong, EPI_ISL_414517, 
HongKong/case85_VM20002868/2020, , unassigned, Hong Kong, Hong Kong, , 2020.1489071038252, Hong Kong Department of Health, School of Public Health, The University of Hong Kong, EPI_ISL_414519, 
NODE_0000428, ORF1a: L3606F, A1a, Hubei, , G11083T, 2020.0585337733946, , , , 
Wuhan/WH05/2020, ORF1a: Y534C, G1100S, A1a, Hubei, China, A1866G; G3563A, 2020.1024590163934, Wuhan Fourth Hospital, Beijing Genomics Institute (BGI), EPI_ISL_408978, 
Hangzhou/ZJU-01/2020, S: R682Q, A1a, Zhejiang, China, G23607A, 2020.0669398907103, State Key Laboratory for Diagnosis and Treatment of Infectious Diseases, National Clinical Research Center for Infectious Diseases, First Affiliated Hospital, Zhejiang University School of Medicine, Hangzhou, China. 310003, State Key Laboratory for Diagnosis and Treatment of Infectious Diseases, National Clinical Research Center for Infectious Diseases, First Affiliated Hospital, Zhejiang University School of Medicine, Hangzhou, China. 310003, EPI_ISL_415709, 
NODE_0000254, , A1a, Hubei, , , 2020.067105050305, , , , 
NODE_0000433, ORF1a: E217G, A1a, Tbilisi, , A915G, 2020.1567991026213, , , , 
Georgia/Tb-468/2020, ORF1a: L3352F, A1a, Tbilisi, Georgia, C10319T, 2020.1898907103825, R. G. Lugar Center for Public Health Research,  National Center for Disease Control and Public Health (NCDC) of Georgia., R. G. Lugar Center for Public Health Research,  National Center for Disease Control and Public Health (NCDC) of Georgia., EPI_ISL_415643, 
Georgia/Tb-54/2020, , A1a, Tbilisi, Georgia, , 2020.1571038251366, R. G. Lugar Center for Public Health Research,  National Center for Disease Control and Public Health (NCDC) of Georgia., R. G. Lugar Center for Public Health Research,  National Center for Disease Control and Public Health (NCDC) of Georgia., EPI_ISL_415641, 
NODE_0000256, , A1a, Hubei, , , 2020.077868852459, , , , 
Italy/SPL1/2020, , A1a, Lazio, Italy, , 2020.077868852459, Department of Infectious Diseases, Istituto Superiore di Sanita, Rome, Italy, Virology Laboratory, Scientific Department, Army Medical Center, EPI_ISL_412974, 
Italy/INMI1-cs/2020_travel_history, , , Hubei, , , 2020.077868852459, , , , 
Italy/INMI1-cs/2020, , A1a, Lazio, Italy, , 2020.077868852459, INMI Lazzaro Spallanzani IRCCS, Laboratory of Virology, INMI Lazzaro Spallanzani IRCCS, EPI_ISL_410546, 
NODE_0000434, , A1a, England, , C14805T, 2020.0772929644736, , , , 
USA/WA3-UW1/2020_travel_history, , , South Korea, , , 2020.1571038251366, , , , 
USA/WA3-UW1/2020, ORF1a: A1049V, M1769I, A1a, Washington, USA, T2446C; C3411T; G5572T, 2020.1571038251366, Harborview Medical Center, UW Virology Lab, EPI_ISL_413025, MT163716
England/20102000106/2020, , A1a, England, United Kingdom, C23707T; T27384C, 2020.1571038251366, Respiratory Virus Unit, Microbiology Services Colindale, Public Health England, Respiratory Virus Unit, Microbiology Services Colindale, Public Health England, EPI_ISL_415144, 
Netherlands/NoordBrabant_5/2020, ORF3a: V251G, A1a, North Brabant, Netherlands, T1570C; C3037T; T26144G, 2020.1762295081967, Dutch COVID-19 response team, Erasmus Medical Center, EPI_ISL_414430, 
NODE_0000442, ORF1a: I739V, P765S, A1a, England, , A2480G; C2558T, 2020.1021709231923, , , , 
England/09c/2020_travel_history, , , Hubei, , , 2020.1079234972678, , , , 
England/09c/2020, , A1a, England, United Kingdom, , 2020.1079234972678, Respiratory Virus Unit, Microbiology Services Colindale, Public Health England, Respiratory Virus Unit, Microbiology Services Colindale, Public Health England, EPI_ISL_412116, 
Scotland/CVR07/2020, ORF1a: P885S, P1692L, A1a, Scotland, United Kingdom, C2918T; C5340T, 2020.1871584699454, West of Scotland Specialist Virology Centre, NHSGGC, MRC-University of Glasgow Centre for Virus Research, EPI_ISL_415630, 
NODE_0000259, , A1a, England, , , 2020.1331579403934, , , , 
NODE_0000260, , A1a, Netherlands, , , 2020.156718328326, , , , 
Netherlands/NA/21/2020, , A1a, Netherlands, Netherlands, G210T, 2020.1844262295083, Dutch COVID-19 response team, Erasmus Medical Center, EPI_ISL_415478, 
Canada/BC_78548/2020_travel_history, , , Europe, , , 2020.1762295081967, , , , 
Canada/BC_78548/2020, , A1a, British Columbia, Canada, A1981G, 2020.1762295081967, BCCDC Public Health Laboratory, BCCDC Public Health Laboratory, EPI_ISL_415590, 
NODE_0000261, , A1a, England, , , 2020.1414817256627, , , , 
